iterationName	gameid	time	trialNum	role	text	reactionTime	eventType
pilot1	9582-00e3c4d2-90d0-401c-b1c4-fe721897156d	1508178686163	0	b	elleps are the yellow flowers	9777	chatMessage
pilot1	9582-00e3c4d2-90d0-401c-b1c4-fe721897156d	1508178867992	1	b	the little red birds and the big green birds are the given species	15211	chatMessage
pilot1	9582-00e3c4d2-90d0-401c-b1c4-fe721897156d	1508178891801	1	b	hello?	1345	chatMessage
pilot1	9582-00e3c4d2-90d0-401c-b1c4-fe721897156d	1508179018715	2	b	I'm not sure which are zorbs. It was a fix of red and yellow and various features.	20136	chatMessage
pilot1	9582-00e3c4d2-90d0-401c-b1c4-fe721897156d	1508179024495	2	b	*mix	932	chatMessage
pilot1	9582-00e3c4d2-90d0-401c-b1c4-fe721897156d	1508179087889	3	b	it seemed like a random selection, I was unable to identify a pattern	13230	chatMessage
pilot1	9582-00e3c4d2-90d0-401c-b1c4-fe721897156d	1508179172696	4	b	again, i was unable to find a real pattern	6863	chatMessage
pilot1	9582-00e3c4d2-90d0-401c-b1c4-fe721897156d	1508179238813	5	b	plovs are generally yellow. they can also be big and red	8786	chatMessage
